{
  "status": "accepted",
  "contextAndProblemStatement": "Should this ref pass the CI gate? 3 check run(s) reported; required: build, test, lint.",
  "decisionDrivers": [
    "build: success",
    "test: success",
    "lint: success"
  ],
  "consideredOptions": [
    "pass",
    "wait",
    "fail"
  ],
  "decisionOutcome": {
    "chosenOption": "pass",
    "justification": "all 3 required check(s) concluded successfully"
  },
  "consequences": {
    "positive": [
      "build success",
      "test success",
      "lint success"
    ],
    "negative": []
  },
  "confirmation": "Re-run this evaluation immediately before acting on it; check runs can be re-triggered and superseded."
}
